<?xml version="1.0" encoding="UTF-8"?>
<!--DTD generated by XMLSpy v2007 (http://www.altova.com)-->
<!ELEMENT menuItem (#PCDATA)>
<!ELEMENT button (#PCDATA)>
<!ELEMENT MyConfiguration ((Menu+, Buttons))>
<!ELEMENT Menu ((menuItem+))>
<!ATTLIST Menu
	name CDATA #REQUIRED
>
<!ELEMENT Buttons ((button+))>
<!ATTLIST Buttons
	positions (South | North | East | West) "South"
>
